{
  "schema_version": 1,
  "issue_url": "https://github.com/JonatanGarbuyo/agents-workflow/issues/5",
  "pull_request_url": "https://github.com/JonatanGarbuyo/agents-workflow/pull/2",
  "stage": "A",
  "runner": "actions",
  "run_id": "fixture-stage-a",
  "started_at": "2026-10-12T16:00:00Z",
  "outcome": "progress",
  "start_commit": "2ab7e0e",
  "end_commit": "448d984",
  "changed_files": [
    "examples/vertical-slice/fixture-stage-a.txt"
  ],
  "validation": {
    "command": "node scripts/validate-vertical-slice.mjs --stage A",
    "result": "passed"
  },
  "checkpoint_observed": "none",
  "next_action": "Resume from this commit and add stage-b-complete."
}
